{
  "$schema": "https://json-schema.org/draft/2020-12/schema",
  "$id": "https://codefarmer.dev/schemas/codefarmer.config.schema.json",
  "title": "CodeFarmer configuration",
  "description": "Project or user configuration for the CodeFarmer CLI. Provider API keys are supplied through environment variables or the local credentials file and cannot be stored here.",
  "type": "object",
  "additionalProperties": false,
  "properties": {
    "$schema": { "type": "string" },
    "language": {
      "type": "string",
      "enum": ["en", "zh-CN"],
      "default": "en",
      "description": "Interface and agent response language."
    },
    "provider": {
      "oneOf": [
        {
          "type": "string",
          "minLength": 1,
          "description": "Built-in provider (openai, gemini, grok, deepseek, kimi, opencode-go) or the id of a customEndpoints entry."
        },
        {
          "type": "object",
          "additionalProperties": false,
          "required": ["baseURL", "model"],
          "description": "Inline custom OpenAI-compatible endpoint; id defaults to the baseURL hostname.",
          "properties": {
            "id": {
              "type": "string",
              "minLength": 1,
              "maxLength": 64,
              "pattern": "^[A-Za-z0-9][A-Za-z0-9_-]*$",
              "description": "Optional unique id; must not collide with built-in provider names."
            },
            "label": { "type": "string", "minLength": 1, "maxLength": 64 },
            "baseURL": {
              "type": "string",
              "format": "uri",
              "pattern": "^https?://[^?#]+$",
              "description": "OpenAI-compatible API base URL without credentials, query, or fragment."
            },
            "model": { "type": "string", "minLength": 1 },
            "apiKeyEnv": {
              "type": "string",
              "minLength": 1,
              "maxLength": 128,
              "description": "Environment variable holding the API key; falls back to CODEFARMER_API_KEY and the local credentials file."
            },
            "apiKeyOptional": {
              "type": "boolean",
              "description": "Set true for local keyless endpoints (e.g. Ollama, vLLM) to skip the API key check."
            }
          }
        }
      ],
      "default": "openai",
      "description": "Built-in provider name, a customEndpoints id, or an inline custom endpoint definition."
    },
    "model": { "type": "string", "minLength": 1, "default": "gpt-5.6-sol" },
    "baseURL": {
      "type": "string",
      "format": "uri",
      "pattern": "^https?://[^?#]+$",
      "default": "https://api.openai.com/v1",
      "description": "OpenAI-compatible API base URL without credentials, query, or fragment."
    },
    "customEndpoints": {
      "type": "array",
      "maxItems": 50,
      "description": "Additional user-defined OpenAI-compatible API endpoints, referenced by id via provider.",
      "items": {
        "type": "object",
        "additionalProperties": false,
        "required": ["id", "baseURL", "model"],
        "properties": {
          "id": {
            "type": "string",
            "minLength": 1,
            "maxLength": 64,
            "pattern": "^[A-Za-z0-9][A-Za-z0-9_-]*$",
            "description": "Unique id used by the provider field; must not collide with built-in provider names."
          },
          "label": { "type": "string", "minLength": 1, "maxLength": 64 },
          "baseURL": {
            "type": "string",
            "format": "uri",
            "pattern": "^https?://[^?#]+$",
            "description": "OpenAI-compatible API base URL without credentials, query, or fragment."
          },
          "model": { "type": "string", "minLength": 1 },
          "apiKeyEnv": {
            "type": "string",
            "minLength": 1,
            "maxLength": 128,
            "description": "Environment variable holding the API key; falls back to CODEFARMER_API_KEY and the local credentials file."
          },
          "apiKeyOptional": {
            "type": "boolean",
            "description": "Set true for local keyless endpoints (e.g. Ollama, vLLM) to skip the API key check."
          }
        }
      }
    },
    "reasoning": {
      "type": "string",
      "enum": ["auto", "none", "low", "medium", "high", "xhigh", "max"],
      "default": "high",
      "description": "Reasoning effort. Defaults to high for deeper thinking; lower levels reduce reasoning and completion tokens."
    },
    "verbosity": {
      "type": "string",
      "enum": ["low", "medium", "high"],
      "default": "low",
      "description": "Text response detail level. Lower values reduce output tokens."
    },
    "reasoningSummary": {
      "type": "string",
      "enum": ["none", "auto", "concise", "detailed"],
      "default": "none",
      "description": "Visible reasoning summary detail. 'none' omits summaries and reduces output tokens."
    },
    "approval": {
      "type": "string",
      "enum": ["ask", "auto", "read-only"],
      "default": "ask"
    },
    "stream": { "type": "boolean", "default": true },
    "store": {
      "type": "boolean",
      "const": true,
      "default": true,
      "description": "CodeFarmer v1 requires server-side response state for previous_response_id continuation."
    },
    "logLevel": {
      "type": "string",
      "enum": ["trace", "debug", "info", "warn", "error", "fatal", "silent"],
      "default": "info"
    },
    "maxAgentTurns": { "type": "integer", "minimum": 1, "maximum": 100, "default": 12 },
    "maxFileSizeBytes": {
      "type": "integer",
      "minimum": 1,
      "maximum": 104857600,
      "default": 1048576
    },
    "maxToolOutputBytes": {
      "type": "integer",
      "minimum": 1,
      "maximum": 10485760,
      "default": 12288
    },
    "commandTimeoutMs": {
      "type": "integer",
      "minimum": 1000,
      "maximum": 3600000,
      "default": 120000
    },
    "autoCompact": {
      "type": "boolean",
      "default": true,
      "description": "Automatically compress the early part of a session once it grows past the autoCompact thresholds, before a turn runs."
    },
    "autoCompactMinMessages": {
      "type": "integer",
      "minimum": 2,
      "maximum": 100000,
      "default": 40,
      "description": "Auto-compact once the stored conversation exceeds this many messages."
    },
    "autoCompactMinChars": {
      "type": "integer",
      "minimum": 1000,
      "maximum": 52428800,
      "default": 100000,
      "description": "Auto-compact once the stored message content exceeds this many characters."
    },
    "ignoredPaths": {
      "type": "array",
      "items": { "type": "string", "minLength": 1 },
      "maxItems": 1000,
      "uniqueItems": true
    },
    "budgetUsd": {
      "type": "number",
      "exclusiveMinimum": 0,
      "maximum": 1000000,
      "description": "Optional per-session cost ceiling in USD. Once the cumulative estimated cost of a session reaches this amount, new turns are refused until the budget is raised or a new session starts."
    }
  }
}
