{
  "provider": "deepseek",
  "model": "deepseek-v4-flash",
  "baseURL": "https://api.deepseek.com",
  "reasoning": "medium",
  "verbosity": "low",
  "reasoningSummary": "none",
  "maxAgentTurns": 12,
  "maxToolOutputBytes": 12288,
  "approval": "auto",
  "$schema": "https://unpkg.com/codefarmer@0.1.0/schemas/codefarmer.config.schema.json"
}
